{"asOf":"2026-10-29","horizon":["2026-11","2026-12","2027-01","2027-02","2027-03","2027-04"],"nPaths":10000,"seed":20261024,"method":"weather bootstrap (the same months of 2017..2025, +/-7 days) x rolling 2-year weather model fit to 2026-10-19 x 3-state HMM regime-switching residual (tied sd)","levelAdjustment":{"source":"none: observed load","ratio":1.0},"recentLevel":{"NEMA":1.0049,"SEMA":1.0085,"WCMA":0.9973},"levelSdPct":{"NEMA":1.768,"SEMA":1.639,"WCMA":2.638},"areas":[{"area":"NEMA","unit":"GWh","months":[{"ym":"2026-11","p5":1723.625,"p10":1745.466,"p25":1778.47,"p50":1816.008,"p75":1852.507,"p90":1885.295,"p95":1903.739},{"ym":"2026-12","p5":1993.658,"p10":2018.181,"p25":2060.581,"p50":2107.533,"p75":2158.11,"p90":2216.027,"p95":2262.713},{"ym":"2027-01","p5":2052.071,"p10":2083.379,"p25":2138.599,"p50":2206.183,"p75":2270.474,"p90":2324.206,"p95":2355.324},{"ym":"2027-02","p5":1834.468,"p10":1860.243,"p25":1903.801,"p50":1957.081,"p75":2015.118,"p90":2071.015,"p95":2108.458},{"ym":"2027-03","p5":1840.129,"p10":1860.594,"p25":1897.528,"p50":1938.303,"p75":1980.526,"p90":2017.604,"p95":2039.717},{"ym":"2027-04","p5":1628.769,"p10":1648.005,"p25":1679.555,"p50":1713.432,"p75":1747.395,"p90":1779.511,"p95":1798.361}],"total":{"p5":11296.597,"p10":11398.504,"p25":11559.319,"p50":11747.157,"p75":11931.83,"p90":12107.454,"p95":12212.313},"samplePaths":[[1775.265,2152.434,2214.373,1941.449,1959.704,1759.064],[1734.979,2063.548,2178.107,1894.765,1916.33,1687.401],[1963.058,2235.744,2333.335,1934.606,2066.143,1845.084],[1880.059,2110.33,2243.472,1959.151,2050.583,1712.844],[1813.101,2105.425,2336.41,2046.87,1993.939,1725.277],[1823.65,2112.554,2108.901,1964.153,1966.872,1646.926],[1884.218,2123.41,2274.383,2037.223,1950.402,1652.358],[1819.671,2083.207,2092.366,1985.608,1949.045,1732.215],[1874.566,2079.381,2193.568,2028.179,2005.971,1891.565],[1839.796,2101.294,2041.294,1862.588,1922.386,1693.329],[1832.492,2152.575,2144.284,1934.124,1998.548,1830.778],[1799.598,2035.319,2368.802,1996.913,1965.861,1757.905],[1757.434,2122.624,2367.844,1909.261,1967.191,1686.343],[1893.319,2154.557,2299.293,1914.504,1945.911,1727.237],[1797.318,2033.35,2063.936,1831.376,1927.285,1730.972],[1844.51,2090.344,2150.756,2014.339,1997.063,1712.063],[1808.091,2033.753,2117.32,1894.949,1904.575,1729.249],[1784.053,2130.867,2149.493,1939.615,1969.403,1790.481],[1760.774,2004.909,2274.518,1939.346,1801.332,1641.522],[1862.151,2041.867,2187.887,2036.199,2017.865,1737.01]],"sameMonthsLastObservedGWh":[1824.478,2191.13,2294.955,2062.939,1951.247,1702.701]},{"area":"SEMA","unit":"GWh","months":[{"ym":"2026-11","p5":1018.874,"p10":1030.623,"p25":1051.119,"p50":1074.395,"p75":1098.704,"p90":1121.522,"p95":1134.993},{"ym":"2026-12","p5":1204.329,"p10":1217.496,"p25":1240.942,"p50":1268.534,"p75":1300.368,"p90":1333.323,"p95":1359.137},{"ym":"2027-01","p5":1213.72,"p10":1230.219,"p25":1259.607,"p50":1298.899,"p75":1338.16,"p90":1373.65,"p95":1393.599},{"ym":"2027-02","p5":1056.277,"p10":1071.092,"p25":1097.094,"p50":1128.119,"p75":1162.788,"p90":1201.216,"p95":1229.357},{"ym":"2027-03","p5":1065.716,"p10":1078.046,"p25":1098.05,"p50":1122.096,"p75":1147.659,"p90":1172.505,"p95":1189.4},{"ym":"2027-04","p5":932.621,"p10":942.299,"p25":958.55,"p50":977.586,"p75":997.871,"p90":1015.937,"p95":1027.286}],"total":{"p5":6635.318,"p10":6687.264,"p25":6776.208,"p50":6878.838,"p75":6988.489,"p90":7089.873,"p95":7150.397},"samplePaths":[[1042.71,1298.899,1318.881,1159.588,1143.512,966.171],[1081.226,1211.54,1275.79,1122.72,1114.778,985.105],[1089.43,1303.957,1317.0,1074.11,1160.54,990.796],[1095.761,1303.307,1336.054,1107.813,1120.21,948.602],[1064.705,1214.527,1376.453,1161.386,1148.187,986.735],[1055.579,1217.911,1253.144,1151.875,1085.648,974.741],[1137.348,1306.514,1321.206,1184.953,1134.18,977.98],[1069.157,1227.395,1256.03,1087.042,1090.006,998.124],[1107.479,1291.571,1258.891,1171.657,1162.288,988.113],[1027.809,1243.256,1200.103,1119.433,1126.494,1004.678],[1097.006,1337.472,1257.816,1145.236,1131.083,1008.028],[1065.62,1250.386,1415.591,1110.277,1177.785,1033.395],[1050.062,1281.604,1385.745,1104.562,1139.617,991.681],[1089.053,1250.085,1251.231,1094.096,1130.718,1029.113],[1038.263,1259.66,1166.67,1049.163,1067.179,974.804],[1068.539,1241.839,1234.681,1188.251,1139.715,966.394],[1068.922,1239.34,1281.802,1107.177,1126.261,957.358],[1177.116,1302.835,1302.896,1122.799,1116.461,1002.293],[1060.029,1263.97,1304.642,1139.057,1059.506,950.75],[1027.748,1218.32,1289.378,1162.659,1113.603,984.794]],"sameMonthsLastObservedGWh":[1075.774,1309.765,1358.651,1205.985,1143.377,973.108]},{"area":"WCMA","unit":"GWh","months":[{"ym":"2026-11","p5":1164.652,"p10":1181.132,"p25":1208.711,"p50":1242.466,"p75":1276.674,"p90":1309.095,"p95":1328.786},{"ym":"2026-12","p5":1359.721,"p10":1380.011,"p25":1416.82,"p50":1457.78,"p75":1502.985,"p90":1550.915,"p95":1585.057},{"ym":"2027-01","p5":1390.014,"p10":1413.404,"p25":1457.237,"p50":1507.306,"p75":1557.466,"p90":1602.148,"p95":1628.474},{"ym":"2027-02","p5":1246.694,"p10":1267.753,"p25":1301.732,"p50":1342.919,"p75":1386.116,"p90":1427.459,"p95":1450.006},{"ym":"2027-03","p5":1229.084,"p10":1246.285,"p25":1275.553,"p50":1309.214,"p75":1346.098,"p90":1380.373,"p95":1401.874},{"ym":"2027-04","p5":1065.488,"p10":1080.554,"p25":1105.898,"p50":1133.365,"p75":1162.046,"p90":1189.653,"p95":1205.528}],"total":{"p5":7587.092,"p10":7676.148,"p25":7831.999,"p50":8004.771,"p75":8175.693,"p90":8337.635,"p95":8439.018},"samplePaths":[[1222.524,1457.218,1490.716,1413.612,1333.941,1143.635],[1220.674,1395.992,1471.056,1378.723,1307.653,1100.625],[1306.362,1579.107,1641.147,1357.295,1428.98,1203.959],[1277.611,1457.653,1573.172,1415.201,1324.467,1146.866],[1303.26,1464.939,1650.073,1339.547,1339.063,1115.529],[1176.459,1422.912,1421.15,1326.849,1215.817,1058.102],[1364.895,1532.04,1625.963,1473.443,1355.972,1169.502],[1250.211,1433.048,1487.057,1382.18,1318.403,1131.763],[1255.392,1502.783,1587.061,1377.489,1368.292,1171.52],[1203.535,1438.93,1361.943,1250.848,1293.198,1113.438],[1206.186,1516.224,1422.378,1357.023,1341.369,1141.028],[1265.922,1495.027,1640.159,1314.758,1368.776,1203.794],[1264.734,1419.563,1568.729,1285.474,1285.639,1143.454],[1267.648,1490.853,1454.118,1317.626,1299.495,1145.195],[1171.658,1377.23,1369.67,1232.451,1229.37,1142.175],[1181.157,1400.213,1462.632,1353.214,1300.96,1145.479],[1239.264,1388.953,1500.319,1294.231,1321.62,1093.048],[1359.792,1498.004,1468.65,1309.325,1297.594,1148.143],[1195.189,1361.884,1480.652,1333.923,1185.021,1051.732],[1245.539,1457.337,1508.315,1367.397,1301.713,1144.651]],"sameMonthsLastObservedGWh":[1262.307,1528.166,1583.079,1420.258,1329.219,1128.72]},{"area":"MA","unit":"GWh","months":[{"ym":"2026-11","p5":3945.031,"p10":3985.409,"p25":4054.319,"p50":4131.296,"p75":4211.8,"p90":4288.557,"p95":4334.768},{"ym":"2026-12","p5":4596.419,"p10":4647.102,"p25":4733.965,"p50":4830.243,"p75":4944.088,"p90":5071.503,"p95":5179.902},{"ym":"2027-01","p5":4685.667,"p10":4748.118,"p25":4866.862,"p50":5014.013,"p75":5155.992,"p90":5271.742,"p95":5339.657},{"ym":"2027-02","p5":4173.978,"p10":4221.776,"p25":4314.29,"p50":4429.385,"p75":4551.151,"p90":4671.552,"p95":4755.109},{"ym":"2027-03","p5":4170.037,"p10":4213.68,"p25":4285.455,"p50":4369.975,"p75":4460.019,"p90":4542.128,"p95":4596.203},{"ym":"2027-04","p5":3662.293,"p10":3697.304,"p25":3757.321,"p50":3824.766,"p75":3891.828,"p90":3956.193,"p95":3996.847}],"total":{"p5":25577.412,"p10":25817.481,"p25":26198.504,"p50":26634.202,"p75":27075.894,"p90":27484.964,"p95":27729.138},"samplePaths":[[4040.499,4908.551,5023.97,4514.649,4437.157,3868.87],[4036.879,4671.08,4924.953,4396.208,4338.761,3773.131],[4358.85,5118.807,5291.481,4366.012,4655.663,4039.839],[4253.431,4871.29,5152.697,4482.164,4495.26,3808.312],[4181.066,4784.891,5362.935,4547.803,4481.189,3827.541],[4055.688,4753.376,4783.195,4442.877,4268.336,3679.77],[4386.461,4961.964,5221.552,4695.618,4440.554,3799.84],[4139.04,4743.651,4835.454,4454.83,4357.454,3862.102],[4237.438,4873.734,5039.52,4577.325,4536.551,4051.198],[4071.14,4783.48,4603.34,4232.869,4342.078,3811.445],[4135.684,5006.271,4824.478,4436.382,4470.999,3979.833],[4131.14,4780.732,5424.553,4421.949,4512.422,3995.093],[4072.231,4823.791,5322.318,4299.297,4392.447,3821.479],[4250.021,4895.495,5004.643,4326.226,4376.125,3901.545],[4007.239,4670.24,4600.276,4112.989,4223.835,3847.951],[4094.206,4732.396,4848.069,4555.804,4437.737,3823.936],[4116.277,4662.046,4899.44,4296.357,4352.456,3779.655],[4320.96,4931.706,4921.039,4371.739,4383.458,3940.917],[4015.992,4630.762,5059.813,4412.326,4045.858,3644.004],[4135.438,4717.525,4985.579,4566.254,4433.181,3866.455]],"sameMonthsLastObservedGWh":[4162.559,5029.061,5236.685,4689.182,4423.843,3804.529]}],"calibration":{"trainEnd":"2021-10-31","test":"2021-11..2022-04 and 2022-11..2023-04","nMonths":36,"cov80":0.8889,"cov90":1.0,"maeVsNaive":1.0652},"backtest":{"winters":"2019-20 .. 2025-26","nWinters":7,"nMonths":126,"cov80":0.8016,"cov90":0.8651,"maeVsNaive":0.962,"totalBiasPct":0.35,"totalMaePct":2.23,"totalCov80":0.5714},"notes":["Regional load of all customer classes, observed daily through 2026-10-19 (ISO-NE 2017-2023, then EIA-930). The horizon is the 6 full months after the last observed day and moves forward as data arrives.","sameMonthsLastObservedGWh = the load actually observed in the same months a year earlier (2025-11 .. 2026-04).","Calibration fit only on data <= 2021-10-31, weather from seasons 2017-2021.","MA = the three zones summed per path; zone residuals are simulated independently (MA spread may be too narrow).","recentLevel = 1 + each zone's mean miss of the 2-year weather model over the last 365 days (carries a load trend to today); levelSdPct = how far that level has moved over 6 months, drawn once per path. backtest = the same method refit before each winter 2019-20 .. 2025-26: 80% range held 80% of 126 zone-months; 6-month total off by 2.2% on average."]}